FirstName,LastName,DateOfBirth,ProductID,Star,Comment
Jenda,Parres,8/24/1985,186, 4.0 , This is an excellent kit that has been around for more than fifty years . Detail is not what would be expected these days - the heavily applied boiler bands and handrails  detract from an otherwise accurate kit . These faults can  however  be rectified with care and despite this  the basic kit has been the basis over the years for countless  motorised  working  models . Not only can the kit be used to build a GWR City class loco but determined kitbashers can use it as the basis for several broadly similar GWR classes from the early years of the twentieth century . Recommended for those prepared to invest the effort . 
Jenda,Parres,8/24/1985,187, 4.0 , Its a good plastic kit and is fun to make. Downside is that because it comes in a plastic bag instead of a box some of the parts are a little bit bent out of shape because of this. 
Jenda,Parres,8/24/1985,210, 5.0 , This particular model kit has its origins a half-century ago. and people have converted them with a lot of skilled work to run on OO-gauge model railways. As a static model it needs careful work. It will reward extra effort. This isnt for the beginner. It has to lose a star because the manufacturing standards have improved. A modern kit could be so much better. But one day there just wont be any more of this model.
Etty,Piercy,12/6/1970,189, 5.0 , Just what I was looking for
Etty,Piercy,12/6/1970,190, 5.0 , These are really nice quality HO coaches and lightweight too so you can pull quite a number behind even the smallest loco.I bought several for branch line operation and they certainly add inpact to the layout.
Etty,Piercy,12/6/1970,191, 5.0 , great
Etty,Piercy,12/6/1970,192, 5.0 , True to product discription 
Etty,Piercy,12/6/1970,193, 2.0 , Much smaller than thought. 
Etty,Piercy,12/6/1970,194, 5.0 , charming little train
Etty,Piercy,12/6/1970,195, 4.0 , Just built one of these! The body is self coloured in the right colour and the sides are lined out and lettered. The ends need to be painted black. Apart from the roof ventilators (which can be glued inside the roof) the whole kit clicks together ingeniously. It took about 10 mins to assemble this kit and the next will take more like 4 minutes. The only transfers/decals are the round LMS logos you can see in the centre.I dont agree with the assembly instructions! The body comprises sides ends and floor in a single piece. There is a rectangular cutout in the floor for the metal weight. I would fit the interior seat moulding into the body first. There is very little space between the compartment walls and the side of the coach to feed the flush-glaze window strips in. (They cant go in first) Particularly on the 2nd window strip I was concerned that I might overstretch the coach side at the end and make the plastic go milky. I was relieved when the glazing clicked into the windows. At that point with the windows correctly in place the corridor connections can be slid in the ends and the underframe offered up to the body (upside down with the metal weight located). The underframe latches actually click into the window strips to tie it all together. Likewise the roof clicks onto tabs on the window strips. Ingenious!Assembling and fitting the bogies was quite easy. The coupling retainers were fiddly though. Each coupling is plastic with a black metal hook. One of the hooks fell off. There is a C shape feature which clips onto a plastic bar and I needed to crunch it slightly with pliers then adjust outwards with a screwdriver again until it clicked into place. The hook doesnt lift and drop as freely as it should now. Its on account of that and not being able to build the coach in the assembly instruction order (without feeling I was going to break something) that Ive docked a star.
Etty,Piercy,12/6/1970,196, 5.0 , I received this lovely train today and I am really happy with this purchase. I am not a collector but this is a gift for my father in law and I am sure he is going to love it. It is really well packaged comes in its corgi box. Inside this box is a hardened case and the train is secured in it. The attention to detail is fantastic. It is in perfect condition and I am sure that this will make a lovely addition to anyones collection. I really like the stories behind these trains and choosing of the name. It arrived really well packaged and very fast4 days early in fact.  Great buy. May turn me into a collector yet! 
Etty,Piercy,12/6/1970,197, 5.0 , Well made and highly detailed model 
Etty,Piercy,12/6/1970,210, 5.0 , VERY GOOD AND ACCURATE MODEL OF THE DAYS OF STEAM. WELL DONE. Fits perfectly in my display cabinet with the other
Willie,Blaske,1/11/1974,199, 5.0 , Happy with this purchase for our 4 year old grandson who is trainset mad.
Willie,Blaske,1/11/1974,200, 5.0 , Excellent engine arrived a day earlier than expected extremely well wrapped. New and about £10 less than the list price. Just had a test both ways on my layout runs brilliantly- thanks guys. 
Willie,Blaske,1/11/1974,201, 5.0 , My son was very pleased with the product
Willie,Blaske,1/11/1974,202, 5.0 , Arrived in good time. All good and works well. Son is very happy. Thank you.
Willie,Blaske,1/11/1974,203, 5.0 , So cheap but an excellent product. At this price any bulb failures experienced after switch on are no problem - just re-order some more. Arrived on time and were well packed. I dont know how this level of authenticity can be available at such a low price. 
Willie,Blaske,1/11/1974,204, 5.0 , The item was excellent but the scale was 1/100 I would have preferred 1/76 scale. Some information of how to set up the lighting system would have been helpful ie. the size of transformer required for the no of lights being used in parallel or in series 
Willie,Blaske,1/11/1974,205, 5.0 , the single head lamppost lamps complimented the double head lamppost purchased to complete the trainset layout 
Willie,Blaske,1/11/1974,206, 5.0 , These are great so bright and value for money
Willie,Blaske,1/11/1974,207, 5.0 , These ex-LNER Gresley teak-bodied buffet cars built in the 1930s survived long enough to receive all three British Railways coach liveries crimson and cream maroon (in which this model is also currently available) and finally the blue and grey depicted here used from the mid-1960s.  Ive given this one 5* as opposed to the maroon ones 4* as in my opinion it looks much better in this blue and grey livery.  The reviews are virtually the same apart from that rating.  Presumably they lasted so long as a new buffet car cost much more than a new ordinary coach to build. Its stated on the Net that the last one was withdrawn in 1977 from Western Region use as W9135E whilst the one depicted here E9131E lasted only until 1974.This model is up to the usual standard of recent Hornby coaches and whilst a scale person wouldnt fit into the gap between the seats and tables you must peer in through the windows to appreciate the best interior detail. Its a lovely little bar/counter complete with chrome edging an (empty) transparent sandwich display case what looks like a chrome coffee-maker and one of those metal foot-rests running the length of the bar/counter complete with the little pegs that hold it above floor level. No stools though presumably to encourage folks to buy the curly sandwiches over-priced drinks and then bog off back to their seats leaving it clear for more punters to part with their hard-earned.Theres also a representation of the hand-rails at the windows by the buffet bar/counter to hold onto going over the points at junctions (or after a few expensive tinnies (which is all they used to have (and still do as far as Im aware) in the beers department.Read more › 
Willie,Blaske,1/11/1974,208, 5.0 , Fantastic.
Willie,Blaske,1/11/1974,210, 5.0 , My first venture into Hornbys new TTS system - I only have a basic Bachmann E-Z controller which can only provide functions 1 to 9 which work ok - I have no idea what functions 10 to 18 do - very frustrating.  All the mags have tested TTS so no need for me to comment - the chuff is too loud in my book but otherwise Im very pleased indeed with my purchase...
Joana,Waldie,7/6/1986,210, 5.0 , Top notch train with sound as good as the Bachman version. 
Joana,Waldie,7/6/1986,211, 5.0 , Typical Hornby quality especially with their own sound chip which probably knocks over £120 off having to have one fitted. 
Joana,Waldie,7/6/1986,212, 4.0 , Looks great well packaged and arrived quickly..what more do I want
