FirstName,LastName,DateOfBirth,ProductID,Star,Comment
Ethelbert,Retallick,1/13/2003,1, 4.0 , Part of the magic for me growing up as a boy was to buy (or be given) the new Hornby catalogue every year even if it included 90% of the same products as the previous year.  Ive still got my old ones dating back to the 70s and 80s somewhere.  These days the catalogue is especially informative in that it tells you the vintage of the rolling stock which is useful if you are dedicating your railway to one particular era and train company. 
Ethelbert,Retallick,1/13/2003,2, 5.0 , Amazing detail every credit to the photographer in this book a worthy reference manual as well as a sales brochure. even if you only have a passing interest in the hobby you will be transported to another time when we were all younger and in awe of the big trains.
Ethelbert,Retallick,1/13/2003,3, 5.0 , This was purchased on behalf of my Dad. He is always asking me to look up 00 gauge engines online so this has been a good buy as he can look at it anytime. Would definitely buy the next one 2015!It arrived quickly and in perfect condition :-)
Ethelbert,Retallick,1/13/2003,4, 5.0 , Everything I really needed to see what was on offer from Hornby in the way of trains.  Would not have minded it included an RRP as well though 
Ethelbert,Retallick,1/13/2003,5, 1.0 , I collect them all as the glossy pictures are great and it is nice that you can still get catalogs to collect.
Ethelbert,Retallick,1/13/2003,6, 1.0 , What a great book.  Extremely useful insight to all future christmas presents.
Ethelbert,Retallick,1/13/2003,7, 5.0 , Useful info for someonelike me starting back into the hobby after many years
Ethelbert,Retallick,1/13/2003,8, 5.0 , A well produced very good quality catalogue.Super quality pictures.
Ethelbert,Retallick,1/13/2003,9, 4.0 , Very happy with the communication with funkybuys 
Ethelbert,Retallick,1/13/2003,10, 1.0 , Great buy.
Ethelbert,Retallick,1/13/2003,11, 1.0 , Simple & GREAT FUN for 5+My nephews face was amazing when he opened this for his birthday!! His mouth dropped open with surprise! (no joke it literally did!)Its very easy to connect the plastic track/assemble it takes 2 mins. Its very easy to connect the trains together and apply to track.All you need is two AA batteries and time to watch your child enjoy themselves!We even added homemade tunnels to this to make it more fun we simply cut holes in cardboard boxes to put around certain parts of the track!This is brilliant for very young kids if theyre very interested in trains. This gets them started in the hobby and doesnt cost much at all!
Ethelbert,Retallick,1/13/2003,12, 1.0 , Excellent product everybody should have one or to of product  excellent  100 percent ok speedy delivery excellent i give it five stars CLASSIC TOY TRAIN SET TRACK CARRIAGES LIGHT ENGINE BOXED BOYS KIDS BATTERYdouble aa battery goes in top of engine
Ethelbert,Retallick,1/13/2003,13, 1.0 , I was extremely pleased with the train set really good value for money.
Raddie,Moxson,7/15/1985,14, 1.0 , i found this item not suitable for young children  very difficult to keep the carriages together and the whole thing kept coming off the track.All very thin plastic. I would not recommend this item. 
Raddie,Moxson,7/15/1985,15, 1.0 , The Train did not work  and as it was a present for my young nephew for Christmas I was very disappointed but as it was only £7 it was not worth the fuss of ordering another 
Raddie,Moxson,7/15/1985,16, 4.0 , Better than expected. It has a proper oval of track rather than just a circle. My 2 year old grandsn loves it although he finds it difficult to put on the track. 
Raddie,Moxson,7/15/1985,17, 5.0 , Brilliant little train.  Bought for my son who was looking for a train that looks like the polar express - he was not disappointed.  Great value. 
Raddie,Moxson,7/15/1985,18, 3.0 , train carriages kept falling track  of and the connectors not good. better on the floor
Raddie,Moxson,7/15/1985,19, 5.0 , I love it. Perfect with the earlier ordered locomotive.Again: I would recommend it to the masters of the topic. Its not just a toy.
Lilli,Amberger,3/17/1993,20, 5.0 , Bought this for my Grandsons birthday.  He is currently collecting some bits for his train set.  Keeps him away from the TV and computers.  So think it was well worth it. 
Lilli,Amberger,3/17/1993,21, 4.0 , only four this time i here you say but i still highly recommend this product as it is a very well engineered piece of equipment and a very worth while addition to every railway enthusiasts collection young or old alike even those who are just starting out this is a good place to get started she also has the lines (a good body) she is neat sweet and petite she also came well boxed and securely wrapped she also came in on time and delivered by courteous gentleman  again many thanks 
Lilli,Amberger,3/17/1993,22, 5.0 , A beautiful little model engine of years gone by.
Lilli,Amberger,3/17/1993,23, 5.0 , the victorian style added to the character that my husband was trying to acheve with his model train layout
Lilli,Amberger,3/17/1993,24, 1.0 , Good value
Lilli,Amberger,3/17/1993,25, 5.0 , High standard model well worth the wait.  Replaces a model of a Utility Van that has been in production by Triang and Hornby since the 1950s! 
Lilli,Amberger,3/17/1993,26, 4.0 , This a good wagon - thanks
Lilli,Amberger,3/17/1993,27, 5.0 , This has gone down very well this Christmas. Adults and kids collectively enjoy its appearance from around the Christmas tree.Whilst I use this as effectively a Christmas tree decoration it is nevertheless a quality Hornby OO gauge model in its own right and could be used year round for a modelling enthusiast.A word of warning would be that the model is delicate and intricate. If you have cats for example they are sure to damage the delicate parts as they seek to derail the train from the track.
Lilli,Amberger,3/17/1993,28, 1.0 , My 1st Hornby and I absolutely love it. It will look amazing under my Christmas Tree this year too. Takes minutes to set up and works great. Smooth quiet and fantastic.
Lilli,Amberger,3/17/1993,29, 1.0 , Excellent value for money and fits around the base of most Christmas trees. My little boy loved it!!
Lilli,Amberger,3/17/1993,30, 5.0 , Perfect Christmas present for the big kid ordered as a Christmas gift for my dad he loves trains. It arrived on time and looks great.
Lilli,Amberger,3/17/1993,31, 1.0 , As Usual top quality Hornby quality lovely cute set which kids of all ages will adore
Lilli,Amberger,3/17/1993,32, 5.0 , This was a fantastic item and has finally made my Christmas village scene for all to enjoy. Thank you very much.
Lilli,Amberger,3/17/1993,33, 1.0 , Great price arrived in good time packaged well appears to be new and original presentation of train package looks good the train looks fab (realistic) and works well.  My little boy was thrilled...  Pity it didnt make any sounds...
Lilli,Amberger,3/17/1993,34, 1.0 , Really disappointed - train worked twice and then power unit stopped working just in time for Christmas. Son was really excited but the whole controller unit felt flimsy which seems to have been proved by its decision to conk out.
Wells,Bramall,5/1/1956,35, 1.0 , Xmas box for grandsonam sure it will be great
Wells,Bramall,5/1/1956,36, 4.0 , We bought this (and 2 others)for our grandsons and they love them. They now have about 7 and it can get a bit noisy if they decide to press the buttons on all of them at once. they are only 3 and 18 months at the moment and dont play unsupervised! 
Wells,Bramall,5/1/1956,37, 4.0 , This product was a gift for my nephew and he is enjoying playing with it with all the other chuggington interactive trains he got for christmas and so far it is doing everything we expected it to. 
Wells,Bramall,5/1/1956,38, 1.0 , We all loved these chugginton trains and have fun getting them to talk to each other.  My grandson now has six of them and takes them to bed with him.
Wells,Bramall,5/1/1956,39, 5.0 , This is a great addition to the interactive train set all the trains interact with each other. My daughter gets hours of play out of them!
Wells,Bramall,5/1/1956,40, 1.0 , Grandson loved it. Hauls good load
Wells,Bramall,5/1/1956,41, 5.0 , Very good product. Thank you.
Wells,Bramall,5/1/1956,42, 1.0 , very good
Wells,Bramall,5/1/1956,43, 5.0 , Beautiful model If your a fan of the G.W.R this loco is a must have Just that. 
Wells,Bramall,5/1/1956,44, 5.0 , Christmas gift for him in doors he will love it 
Katherine,Rodenhurst,9/11/1973,45, 5.0 , runs very smooth good model
Katherine,Rodenhurst,9/11/1973,46, 1.0 , Great quality lots of detail run nic and smooth great little engine
Katherine,Rodenhurst,9/11/1973,47, 1.0 , Fantastic little set beautifully made and a decent price.
Katherine,Rodenhurst,9/11/1973,75, 5.0 , The product is as expected.  The only worry is it looks like the connections will easily break - not robust
Katherine,Rodenhurst,9/11/1973,49, 5.0 , Very happy with product
Katherine,Rodenhurst,9/11/1973,50, 3.0 , My 2 year old loves chuggington so we decided to get her this set. To be fair i dont think there is much longevity with it and after a while my daughter played with the train itself rather than the train and track although it does still come out now and again. I had read some reviews that you have to keep building the track as it comes apart easily. I think that depends on if your child is heavy handed or not i havent had to keep putting it back together but i could see that if a child was a bit heavy handed then you would be up and down all the time. I have taught my 2 year old to try and put it back together on her own and she can mangae to do some bits but does force them together if they are round the wrong way but time will cure that. Overall yes im glad i got it for her and i dont regret buying it there are better products out there or might be just worth getting them the trains on there own. 
Katherine,Rodenhurst,9/11/1973,58, 5.0 , We have a lot of fun time with my son with this series. It also helps imagination and construction skills as he is building a different rail root every day
Katherine,Rodenhurst,9/11/1973,52, 4.0 , Lovely quality from Kato.
Gun,Casewell,9/3/2014,53, 5.0 , I NOW HAVE A SECOND OF THESE BACHMANN POWERHAULS COMING AS THEY CAN TAKE REAL TRAINS BETWEEN 20-30 WAGONSOF A HEAVY WEIGHT.
Gun,Casewell,9/3/2014,54, 5.0 , This is an excellent HO scale diorama piece comprising of a white enclosed coach with a pair of white horses and two figures on the (red) driving seat dressed in a grey livery. One is a man in a grey greatcoat and top hat the other is a female in a grey coat or uniform jacket and grey jockey-style of cap. There do not appear to be figures inside but if you look through the back window these are heads visible. This is a striking model and would be an excellent decoration for almost any diorama.As you would expect from Preiser these figures are of a high quality of manufacture detail and colouring. Note that I originally paid £20 for my set so it pays to shop around in your local model shops – or even a distant one. I live in London but find it worth travelling as far as Faversham in Kent to the Hobby Shop there for my models.
Gun,Casewell,9/3/2014,55, 5.0 , This is an excellent HO scale diorama piece comprising of a long wooden wagon bearing a very long barrel or wooden cylinder with two horses hauling it and a driver seated on a driving bench. This is an interesting and finely-detailed model and would be an excellent decoration for a farm or country scene.As you would expect from Preiser these figures are of a high quality of manufacture detail and colouring. Note that I originally paid £20 for my set so it pays to shop around in your local model shops – or even a distant one. I live in London but find it worth travelling as far as Faversham in Kent to the Hobby Shop there for my models.
Gun,Casewell,9/3/2014,56, 5.0 , Beautiful little model which I wholeheartedly reccommend.
Gun,Casewell,9/3/2014,57, 5.0 , A nice little train for our layout and a change. Up to the usual Takara Tomy high standard. The little front light is not that bright but looks OK.
Gun,Casewell,9/3/2014,58, 5.0 , Excellent model in perfect condition from reputeable amazon seller however it was returned for a refund because its couplings were not compatable with my other Railjet coaches. I was previously ignorant of the fact that Roco Railjet coaches with internal lighting do not have the same couplings as those without. Roco Railjet coaches 64722 / 64723 / 64724 have internal lighting powered through connections in the couplings.
Gun,Casewell,9/3/2014,59, 5.0 , Got these for my 2 yr old - hes obsessed with trains and loves these characters. They are pretty tough so have survived some bashing. Only thing is that he cant get them to attach to each other with the ball/ socket joint its a bit fiddly so I have to help with that (repeatedly as they do come apart quite easily!) However this wont be an issue as he gets older. Only got Brewster and Wilson this time to see how he got on but think I will be getting the track and Koko for xmas as he plays with these for ages and loves talking to them (not sure he realises the trains talk to each other he just thinks they talk to him... could be setting myself up for years of counselling with that :) 
Cosette,Sumpter,8/17/2002,60, 5.0 , I bought the whole set of chuggington interactive trains and train set for my grandsons to play with when they come to visit which is only twice a year as they live in Italy.  I think I have had more fun with them listening to them speak to each other I am absolutely fascinated with them. 
Ciel,Pinyon,4/25/1943,61, 2.0 , The toy is much larger than other Chugginton toys and doesnt fit on any of the Chuggington rail tracks. Cue disappointed 3 year old. I think this should have been clearer from the description of the toy.Otherwise it works fine and is as described. 
Ciel,Pinyon,4/25/1943,62, 1.0 , I purchased this as well as old Puffer Pete and extra track too for my little 2 year old grandson and he and Daddy love it ..Perfect well made and delivered fast too. 5 stars for a 1st class product and seller too.
Ciel,Pinyon,4/25/1943,63, 4.0 , My 4yr old loves these trains. They are fun when they talk to each other & helps to build up an interactive imaginative game. Not the most robust of toys but fine for kids who dont play too roughly! 
Ciel,Pinyon,4/25/1943,64, 5.0 , I bought this for my son who has a Chuggington train set and its definitely worth having at least 2trains to interact with each other. It took his enjoyment of the track to another level. 
Ciel,Pinyon,4/25/1943,65, 4.0 , Bought for our 2 yr old twin boys to build up their collection great interactive toy and works well with the other Chugginton characters we have. Fast delivery also 
Ciel,Pinyon,4/25/1943,66, 5.0 , Good size very sturdy and well made. The interaction between the trains is very good. Not easy to break very easy to couple the trains together. Great product
Ciel,Pinyon,4/25/1943,67, 5.0 , We love Tomica!
Ciel,Pinyon,4/25/1943,68, 5.0 , It seems as though we are gradually purchasing all of the die cast trains for our 3 year old to play with on his Take Along & Take N Play track. Got this one for his birthday; Molly being yellow was great as this is my sons favourite colour. He spends hours making different tracks and then playing with the trains making up stories. 
Ciel,Pinyon,4/25/1943,69, 5.0 , my boy and girl love molly. especially my 14 month old daughter - seems to have really taken to this yellow engine! good product and great delivery. 
Ciel,Pinyon,4/25/1943,58, 5.0 , My son has a large collection of his trains and they are fantastic well worth the money! Only downside the paint scratches easily.
Ciel,Pinyon,4/25/1943,75, 5.0 , My grandchildren loved Molly I thought she was well made and very pretty. A very nice addition to there Thomas collection.
Ciel,Pinyon,4/25/1943,72, 4.0 , Have to say that this is a lovely itemif a tad expensivebut still a little gem.I managed to get mine at a bargain pricebut if you can too then it is well worth having.My biggest incentive in buying this was to be able to add two extra wooden/teak ex-LNER coaches to the three I already have from the Rare Bird set from the Barry J Freeman range.Those three teaks are very difficult to add todue to most coaches being LNER & not BR.This set means you can have a rake of five!The detail on them is utterly sublime & they are stunninga tenfold better than the teaks in the railroad range.If only they made a BR-numbered buffet car!As for the lovely black British Railways N2 tank loco-well that too is a lovely itemgreat little runner & puller.Only drawback is that the locomotive is not digitally/DCC ready as far as I gather.Not VFM if you consider how much is being outlaid.It comes with a numbered certificate & very attractively decorative box......I give it an eight out of tenwith marks lost on cost & the lack of an easy to fit DCC socket... 
Leandra,Coulton,7/3/1997,73, 4.0 , Hornby R2981 London 1948 train pack with Class N2 BR ex-LNER Brake Composite coach & ex-LNER Full 3rd coach. Olympics Limited Edition. Another beautiful limited edition from Hornby that is an excellent detailed train pack for use or collection : 00 gauge : Individually numbered certificate the official product of London 2012. Class N2 - Motor: 5 pole Skew wound - DCC ready : Pristine finish : Special Features : Sprung buffers Extensive Detail NEM couplings. Shop around for the best price as these have been reduced by Hornby to half price sale some months ago. 
Leandra,Coulton,7/3/1997,74, 4.0 , Whilst the purists complain that this is not an entirely accurate 1948 train (the locomotive was apparently based in Scotland and did not have remote control systems fitted as the model has) it is a great souvenir and the coaches are of extraordinary quality. I suspect it will be a good investment better than any bank at the moment and better made than most Olympic memorabilia 
Leandra,Coulton,7/3/1997,75, 5.0 , The carriages - what can I say - I would suspect the best ready to run ever made - the challenge of the teak effect completely mastered plus absurd levels of detail
Leandra,Coulton,7/3/1997,76, 5.0 , it was as advertised and delivered promptly 
Leandra,Coulton,7/3/1997,77, 5.0 , Easy to wire looks great on the layout. 
Leandra,Coulton,7/3/1997,78, 4.0 , Very satisfied thank you 
Leandra,Coulton,7/3/1997,79, 5.0 , thank you
Leandra,Coulton,7/3/1997,80, 5.0 , Lol
Leandra,Coulton,7/3/1997,210, 5.0 , Great product for the price of the TTS sound Im very impressed
Leandra,Coulton,7/3/1997,82, 5.0 , Elizabeth is a very feisty truck who stands no nonsense from a lot of silly trains. A great addition to the collection 
Leandra,Coulton,7/3/1997,83, 5.0 , My three year old boy absolutely loved this! Very sturdy design - ideal for small children to play with. Brilliant! 
Leandra,Coulton,7/3/1997,84, 5.0 , My Son Loved the series and the Take Along Vehicles.
Leandra,Coulton,7/3/1997,85, 4.0 , This was a present for my brother.  He said it is brilliant and has enjoyed making it. The service I received was good and although it took a little while to arrive it was worth the wait.
Leandra,Coulton,7/3/1997,86, 5.0 , I found no issues with these at all they are great for my son who has sensory issues he walked around everywhere with them bought them after the occupational therapists adviced us we have had them a few weeks now and they still work as good as the day we got them I would highly recommend them.
Leandra,Coulton,7/3/1997,87, 5.0 , An excellent product at an excellent price !! 
Lonnard,Hackinge,6/29/1943,88, 4.0 , Runs well with hornby dcc decoder.
Lonnard,Hackinge,6/29/1943,89, 1.0 , A great addition to the Kato Glacier Express set bringing your train up to a respectable length and it comes in a quality presentation case. Delivery from Japan only takes a couple of weeks. Well worth the money.
Lonnard,Hackinge,6/29/1943,90, 1.0 , Great value although shipped from Japan arrived in good time.
Lonnard,Hackinge,6/29/1943,91, 4.0 , This is a pretty decent starter set as a first step into model railways.You get a very nice detailed model of the Gloucester City and its tender and three equally well-detailed model coaches. The locomotive is DCC-ready. (DCC is the digital control system for model railways allowing different trains to run at different speeds o the same tracks - DCC-ready indicates that the loco has a socket into which a DCC module can be slotted in future; the controller provided with the set is not DCC-compatible.)As with all Hornby starter sets there is sufficient track included for a simple oval circuit with a single siding and one set of points. Hornby points are a bit flimsy - they dont seem to click as positively into one side or the other as I remember those on the model railways of my youth doing but the track is fine otherwise. The fishplates are reassuringly tight and it all slots together easily. There is also a trackmat supplied which is a rather grand name for a large printed sheet of glossy paper with a suggested layout to make all of which requires you to buy rather a lot of extra track and accessories - more a piece of marketing than anything really useful.The supplied controller is a simple rheostat - you can turn the speed up and down and select forward or reverse but its all you need to get started. (If you get keen you can buy a DCC module for the locomotive and a DCC controller to give more control options for a more sophisticated layout.)Putting it all together took 20 minutes or so - its reasonably obvious how you assemble it all which is fortunate as the supplied instructions are a bit sketchy. Not really a problem as most bits will only fit one way!Read more › 
Lonnard,Hackinge,6/29/1943,92, 4.0 , A typical Hornby starter set. The loco is nice and sturdy and has a good weight to it and for a railroad model the detail is very good! The Pullman coaches are equally attractive to look at and feel as though they will last a good while. The track included while a fairly minimal amount is sufficient to get the set moving comfortably. The only downside in my opinion is the controller feels very cheap. I would not expect to see much use from it. However for the fact I am viewing this as simply a test model for something much larger it will not see too much heavy use anyway. The loco runs smoothly and quietly and I cant wait to see it running on a much larger layout! 
Lonnard,Hackinge,6/29/1943,93, 1.0 , Great item as usual from HornbyLoco is well detailed above Hornbys Railroad versions in my opinion.A nice quality set far too good for younger children who would easily damage though a good starter set for the enthusiast.
Lonnard,Hackinge,6/29/1943,94, 4.0 , This is a lovely set to own and my only serious reservation is that you really need to spend quite a lot more on extras to get the best out of it. As a starting point its great though.The track is good-quality but does need a flat solid base. Youll need to spend time getting the creases out of the supplied 1600x1180mm MidiMat too.The detailing on the locomotive and carriages is pretty good. The conn rods move nicely and you can see inside the carriages with their white `table cloths and gold-coloured lamps. It could be better still but most people will be perfectly happy with it as I am.The box suggests all sorts of further sets to enhance this one. The Basic Oval and Track Pack A (R8221) are included to create an extended oval with a siding. Adding Track Packs B and C (R8222 and R8223) gives you a double oval with siding (but just one pair of points connecting them). D and E (R8224 and R8225) make it really interesting but thats almost £100 so far and you can still add F (R8226) for extra sidings. Oh and youll need a new 1800x1200 TrakMat R8217 to go with packs E and F.Then youll want to add accessories such as stations signal boxes and engine sheds. The message is...dont imagine £150 for this set will be the end of your expenditure!Without at least the extra track the set will be pretty dull unless you just want to go round and round in circles with the occasional foray into the siding. Hence 1 star deducted for fun.Some parts notably some of the couplings seem rather fragile. I wouldnt recommend this set for younger children and would suggest 8 as an absolute minimum and only with a lot of adult supervision. 10 or 12 would be better.Read more › 
Lonnard,Hackinge,6/29/1943,95, 4.0 , This is the railroad version of the Duke of Gloucester which is slightly less detailed than the top of the range model and consequently less fragile. The three Pullman coaches are also from the Railroad range and do not have interior lighting as do the top of the range models. It is a pity that the roofs are silver and a bit flashy they would have been better in grey. Another slight inconvenience is that the couplings do not match. The loco has the newer style couplings and the coaches the wider older style but this does not impede hooking up however. This train set was a real bargain at the price I paid at the time.
Lonnard,Hackinge,6/29/1943,96, 5.0 , Although an ex.LMS Stanier prototype this very simple kit from Dapol makes a good generic non-corridor carriage fairly representive of those produced by the Big Four railway companies prior to nationalisation. Derived from ex.Mainline/Airfix tooling these very straightforward kits are a very attractively priced alternative to the increasingly highly priced ready to run items produced by Hornby and Bachman.
Lonnard,Hackinge,6/29/1943,97, 4.0 , I have not built the model yet but look forward to doing so in due course I have several of these fairground models i enjoy building them and watching them work 
