FirstName,LastName,DateOfBirth,ProductID,Star,Comment
Lonnard,Hackinge,6/29/1943,98, 5.0 , Faller kits are very good quality and if you follow the instructions to the letter your model will be great.Ive not yet started on these kits as yet but I have done 32 others all Faller as well as 5 other makes.Delivery and packing by this supplier was excellent the prices were keen 5 star dealer. 
Lonnard,Hackinge,6/29/1943,99, 5.0 , GREAT ITEM THANX! 
Lonnard,Hackinge,6/29/1943,100, 5.0 , Perfect
Lonnard,Hackinge,6/29/1943,101, 5.0 , A heavily built unit of excelent quality and exacting standards. Superior to previous incarnations of standard stock and will haul six carriages with relative ease. 
Lonnard,Hackinge,6/29/1943,102, 5.0 , Excellent value and has brought all my rolling stock to the modern age of Digital the Flying Scotsman locomotive has fantastic detail close up and runs so smooth on the tracks it is is a pleasure to see a age of steam. 
Emmey,Sousa,8/22/1978,103, 4.0 , Beaware...says DCC ready but only works after you buy the separate dcc decoder (currently £16)...Well made trainlovely detail  but we had to wait whilst we ordered the decoder..slightly annoying!...hence 4 star 
Elianora,Grishanin,9/12/1997,104, 4.0 , It is a lovely hornby train and maybe someday kids can play with it too hee hee. Best regards. G 
Elianora,Grishanin,9/12/1997,105, 1.0 , Really impressed with the detail on this model I have several Hornby models and put them in custom glass cases as static models they really look the part!
Elianora,Grishanin,9/12/1997,106, 1.0 , Bought as present for my husband. He was delighted with it. Good price and delivered quickly. Would recommend to others with model railway interests.
Elianora,Grishanin,9/12/1997,107, 5.0 , Im sure my father will adore his christmas gift. 
Elianora,Grishanin,9/12/1997,108, 1.0 , An excellent model very detailed my son actually ended up getting 2 of these for Christmas. The seller wad very understanding and took the product back and issued a full refund without any quibble
Elianora,Grishanin,9/12/1997,109, 1.0 , Good buy and good value buy just wot my son wonted a good for model railway across both tracks and easy to assemble no glue needed to put together
Elianora,Grishanin,9/12/1997,58, 5.0 , This set arrived on the 27th and was in perfect condition thank you
Elianora,Grishanin,9/12/1997,111, 4.0 , grandchildren love itbut it does tend to go round and round a lotdoesnt run well on carpet/rug so need an area thats tiled or laminatedbut well worth the money great value
Elianora,Grishanin,9/12/1997,112, 1.0 , This is a finely-detailed HO-scale model of a Bavarian Sate Railways (Epoch 1) baggage/post wagon in the standard epoch 1 green livery with a black roof. It is a bogie vehicle with end vestibule doors and two sliding doors each side with a guards compartment fitted with a `birdcage roof at one end. Some internal detail can be seen through the windows and sliding doors (unfortunately so can one of the screw-fittings for a bogie). The running number is PPu 17660 and there is a destination board for a Munchen to Berlin service.This model is fitted with the standard `loop style of coupling. It is packaged in the current standard Trix card box with a transparent window with a transparent plasticky internal tray with side cover.This is a beautifully detailed model as you would expect from Trix and is of a high quality of manufacture. Note that there are other models available to form a rake of the Munch to Berlin coaches.
Elianora,Grishanin,9/12/1997,113, 1.0 , An excellent kit of an ex.LMS Stanier non-corridor brake coach that can pass muster as non-corridor stock produced by any of the Big Four railway companies prior to Nationalisation in 1948. Produced from ex.Mainline/Airfix GMR tooling these are simple to assemble kits that are easy to super-detail.
Elianora,Grishanin,9/12/1997,114, 1.0 , Really good service and great product. On time for Christmas :)
Vallie,Simes,2/4/2005,115, 5.0 , Great addition to the auto city set to give a military air to play.
Vallie,Simes,2/4/2005,116, 4.0 , I bought this Train set for my son and am a complete novice when it comes to Train sets.The Hornby set feels solid and attention is paid to the detail on the train. It comes with a mat which is actually a giant printed poster. For the long term a hard backing is needed.The track layout feels like it is the next size up from a basic layout as it already contains an extension pack.The train itself is not huge and looks silly pulling long  passenger carriages (as it would on a real train).It is quite expensive and had I not seen it at a reduced price I probably would not have bought it (hence 4 / 5). The train can actually go quite fast in both directions. As novice I have discovered several features that must be well known to train set enthusiasts:The Trains can be tricky to get all wheels on the track. (I think there is an accessory to help with this)Big Long carriages do not like tight bends at speed (they come off).When using points to guide the train onto an inner circuit (I bought more track) you need to get jumper leads from Hornby and these are not included in Extension packs A & B.Without these the train loses power but I think they are relatively cheap.The Track needs to be cleaned with a cloth as any grease / dirt can stop the power to the trainTrain track has to be carefully aligned when joining one section to another so continually putting it away and getting it out is time consuming - setting it up on a hard backing is a better solution.My child is very careful with the set and its contents but not an ideal present for kids who leave it lying around and step on it (the carriages are expensive). I can see why people like train sets and this is a good introductory set with the plethora of accessories and trains etc from Hornby  and others we were left wanting to buy more bits and pieces (such as electric rather than manual points) after using this set. 
Vallie,Simes,2/4/2005,117, 1.0 , Every child should own a train set and lately Ive started suspecting that every middle-aged man should have one too so I ordered this so that  me and my little lad will have a shared interest. (And  if he turns out to be more interested in video games and hoverboards and whatnot thats OK too: I shall move the layout to my shed and drink homebrew alone whilst building titchy windmills).Its nice to see after not handling  a set since the early 70s that Hornby still maintains that quality old-school feel lots of detailed modelling and reassuring metal components. This starter set represents a small pre-war Welsh local service with both passenger and freight carriages but comes with a printed landscape mat which shows you how you might extend this into a more ambitious layout.Its very difficult to find anything to criticise about this set: I guess everyone knows that Hornby are the Dons of the model railway game and the price is what it is: Theyve always been quite expensive toys. One issue might be that most larger layouts now are apparently controlled digitally whereas this is on an old style analogue controller which I guess means that if you decide to build up to a set with more trains etc this  set would have to run on a separate track?So Im really glad i own a trainset again and am looking forward to spending my dotage buying tiny little tins of humbrol enamel in shades like GWR Olive Drab and staring into the windows of model shops wondering whether to invest in the  1/72 00/H0 Village Garage with Petrol Pump.
Vallie,Simes,2/4/2005,118, 4.0 , My son was purchased this train set for Christmas. My son is mad on trains and loves model train sets set up in shops museums etc. I have never used a Hornby set before but it is clearly well thought out very detailed and is high quality. The first time I put it together I was surprised how fiddly it was it certainly is not for a child to put together. The track was huge but there is not an awful lot of variety to the set it can be oval or circular and thats about it. It comes with a large poster of the ground that is ideal for aesthetics but in the long term its best to be on some sort of hard backing - and here is where the issue with this is. It is such a great toy very classic but to put it on a board is so much more complicated than it appeared for a few reasons. 1. Its huge to put it on a board you need a dedicated space where it could be on a table or put away in some sort of bespoke contraption. We have allocated space under a double bed for the board. A chunk of MDF this size is around £15-£20. 2. My second idea when I realised how much floor space it takes up I thought it may be better to go up a mountain for example but to go up you need to slope very very gradually otherwise it climbs a bit and slides back down. I put one side sloping up using a how to train your dragon book on each side and two at the end and it couldnt climb up the far end. 3. Once you accept its going to take up a loafs of space and once you accept it wont slope upwards much you will naturally look to add variety to the track. We looked at having the large oval with two half circles on the inside by adding 3 3rd radius double curves in two places in the middle (total of 6) as well as one more left hand curve and straight and two right hand curve and straight pieces.Read more ›
Vallie,Simes,2/4/2005,119, 1.0 , This model is something all BR modellers will want and comes at a very reasonable price for a DCC fitted loco. will definitely recommend it & the seller
Vallie,Simes,2/4/2005,120, 4.0 , Fantastic model of a locomotive Ive followed from childhood. NYMR had a fabulous variant steaming and its a joy to behold. 
Anetta,MacKay,8/19/2017,121, 1.0 , FANTASTIC DETAIL HAVE NOT RUN IT YET. BUILD LAYOUT PLANS AT THE AT THIS TIME.
Anetta,MacKay,8/19/2017,122, 1.0 , i am over the moon with this item exemplary service and fantastic value for the item
Anetta,MacKay,8/19/2017,123, 1.0 , Fantastic lamps at a very fair price
Anetta,MacKay,8/19/2017,124, 2.0 , This is a nicely-detailed HO-scale model of a Saxon Sate Railways (Epoch 1) 1st/2nd class express bogie coach - type ABBu - in the standard epoch 1 dark green livery with a light grey roof. This is a very modern style of wooden-framed steel panelled side-corridor coach with a steel chassis and end-vestibule entrances and `concertina connections for accessing other carriages. Some internal detail can be seen through the windows such as the partitions and seating and there are opaque-window lavatory compartments. The running number is 103.This model is fitted with the standard `loop style of coupling. It is packaged in the current standard Piko card box with a transparent window and a transparent plastic side-opening tray inside.This is a nicely detailed model of a high standard of manufacture with a small packet of delicate bits for you to add. There are other models available to form a rake of these coaches.Note that I paid £37 for my model when new so it is worth shopping around in your local model shops - or even a distant one. I live in London but find it worth hopping on a train to Faversham in Kent to the Hobby Shop there for my models.
Anetta,MacKay,8/19/2017,125, 4.0 , Its a power brick what more can be said? This though was the cheapest source for a non to cheap necessity - why it wasnt bundled I dont know! 
Anetta,MacKay,8/19/2017,126, 4.0 , At first I thought it was not for the intended job but was advised that it was working as expected and was doing the job as required so it is a good price and very compact 
Anetta,MacKay,8/19/2017,127, 2.0 , Works well as expected.
Prescott,Paolicchi,11/21/1984,128, 5.0 , as described 
Prescott,Paolicchi,11/21/1984,129, 5.0 , Just what I wanted
Prescott,Paolicchi,11/21/1984,130, 5.0 , Top Spin is a very popular fairground/themepark ride seen under different names. I bought this kit to replace my worn out model built about eight years ago as part of my model fairground which I used to exhibit to raise funds for coronary research and childrens CHUF unit at the Freeman Hospital. Much care is required in building these kits to get the best results theyre fun to build and a delight to run. The quality is excellent and instructions concise. 
Prescott,Paolicchi,11/21/1984,131, 4.0 , Very good
Prescott,Paolicchi,11/21/1984,132, 4.0 , This is an excellent addition to any diecast collection and a must for Harry Potter fans. Looks great in its box. 
Prescott,Paolicchi,11/21/1984,133, 5.0 , This is a very good quality train. Not one to be played with but defiantly a collectors item for the future. 
Prescott,Paolicchi,11/21/1984,134, 5.0 , A great addition to my sons collection well constructed great design and attention to detail.  A great buy for any Harry Potter fan. 
Prescott,Paolicchi,11/21/1984,135, 5.0 , Toy was brought as a joke present for my father in law. He is Harry Potter obsessed and he enjoyed this gift very much. It is of good durability and looks very authentic.
Chaddie,Suffe,5/17/2004,136, 5.0 , Thanks very well made L&YR 2-4-2 Tank by Bachmann .
Chaddie,Suffe,5/17/2004,137, 5.0 , Keeps my husband happy. Well impressed
Chaddie,Suffe,5/17/2004,138, 5.0 , I have recently decided to rebuild my model railway after many years being stored in a box.  I needed a controller and decided that a Gaugemaster was a good choice.  As I will be building the model railway in stages I wanted something to get me started and the single track contoller was ideal.  It didnt take me long to get it conected which is simple. I found it to be very smooth and I could maintain any speed even very slow speeds without a problem and it would just run at that speed for as long as needed.  I will in due course buy a Gaugemaster multi track controller but this is ideal for what I need at this time.  I have been using this controller for several weeks now and I am still very pleased with it. 
Chaddie,Suffe,5/17/2004,139, 4.0 , Next day free delivery! Very small fits easily in the palm of my hand. Screw terminals for the outputs and plug in supply from the transformer input. Very smooth control of locos.Would have preferred the connections on the bottom of the unit for ease of handling. 
Chaddie,Suffe,5/17/2004,140, 5.0 , very happy with my product. works great
Chaddie,Suffe,5/17/2004,141, 5.0 , Very good kit goes together very well.
Chaddie,Suffe,5/17/2004,142, 5.0 , Walthers Proto F7a locomotive is everything you would expect from this range.  Beautiful prototypical details smoothest running qualities and of course the sounds!  Awesome loco in fantastic packaging - it aint cheap but therein lies the truth.  You can go and buy a Bachmann F7a - and theyre great - but this has the hand rails and that extra feel of a quality product.  Some say that Athearn Genesis are the best - but this is a truly wonderful model that gets prominent place in my F7 collection
Chaddie,Suffe,5/17/2004,143, 5.0 , Brilliant! The joy on his face was the picture of Christmas! His reaction when the sound of coal shovelling was heard followed by the toot toot as the train started followed by slow but progressively faster motion of the steam train as it moves left my little boy speechless! A Christmas memory the I will never forget and according to him: my best present ever!Jorge 
Chaddie,Suffe,5/17/2004,144, 4.0 , It arrived late this afternoon. Looks gorgeous. However the Flying Scotsman named engine (60103 according to my 1957 abc Ian Allan book on British Locomotive) was an A3 class not A1. Does Hornby know somethig I dont? I know they moved name plates of engines around but A3s were introduced in 1927 and A1s in 1945. 
Chaddie,Suffe,5/17/2004,145, 1.0 , Bought as present for my myself!. Excellent well constructed model. Great price and delivered quickly. I believe the Railroad range offers great value for all but the most exacting modeler.
Chaddie,Suffe,5/17/2004,146, 1.0 , German Model Train Company in Budget Loco Shocker!Who would have thought it ?This is a great locomotive for kids - top speed is ridiculously fast - but then it is about play value and fun!Running quality is excellent and finish is neat; also nice packagePiko my train puts Hornby Railroad in the shade
Chaddie,Suffe,5/17/2004,147, 1.0 , Easy to install either by slotting directly into OO gauge track or by joining wires to holes in the base plate of the signal. Easy to set-up just assign 2x 2 digit accessory addresses from your DCC controller ( Each signal head is commanded independently ) and its ready to use. Full instructions included along with a ladder & sign plate to add even more realism if you so wish.  I have the Hornby E-link & Railmaster system and these work perfectly with it. Other types of signal are also available with single heads distant & Home types. The real benefit of these signals is that because they are wire-free you can move them on your lay-out quickly if you change your mind or layout so worth the extra cost compared with regular signals. plus they are LED for a long life.
Dov,Goudy,8/16/1975,148, 3.0 , Not bad. Easy to set up but doesnt always sit too well between tracks so be care with that part of it and you cant twist the lights round to face the other direction otherwise its great. 
Dov,Goudy,8/16/1975,149, 5.0 , Grsat priduct and easy to programme
Dov,Goudy,8/16/1975,150, 5.0 , yes would recommend it and according to the recipients wish buy it again perhaps another model
Dov,Goudy,8/16/1975,151, 5.0 , Lovely little engine my son loves it goes very well he is chuffed to bits with it. Swift delivery before estimated date of arrival. Great value for money. 
Dov,Goudy,8/16/1975,152, 5.0 , Good price even with postage. Cheaper than mending my old engine! Arrived earlier than expected. 
Shelli,Rodgman,2/22/2005,153, 5.0 , Arrived before actual delivery date and what I expected so great service. Thank you 
Shelli,Rodgman,2/22/2005,154, 4.0 , Great Xmas present for son loves it ! 
Shelli,Rodgman,2/22/2005,155, 5.0 , Adorable little train. 
Shelli,Rodgman,2/22/2005,156, 5.0 , great wee engine 
Shelli,Rodgman,2/22/2005,157, 5.0 , My Grandson said he didnt like it - he just loved it and it was his favourite Birthday present this year. 
Shelli,Rodgman,2/22/2005,158, 1.0 , Ordered before Christmas and received it spent Jan building track gave train to my son and it does not work.Found out today I cannot return....
Shelli,Rodgman,2/22/2005,159, 5.0 , My son will love this. Ime very pleased with it it looks fab. I also bought the extension pack B to go with it. I know i wont see my son all day  on christmas day 
Shelli,Rodgman,2/22/2005,160, 5.0 , My Young Grandson was over the moon to receive his first train set The Pennine Express. It is an ideal starter kit with lots of extensions to build it up into a very interesting set.Already he is up to extension Track Pack C !!We are all running out of money after Xmas and his birthday is coming  LOL 
Waldo,Elcombe,7/3/1986,161, 1.0 , Excellent set. Excellent value. I was particularly attracted having lived as a child overlooking one of the Trans-Pennine routes and very much enjoyed watching the trains.
Waldo,Elcombe,7/3/1986,162, 5.0 , it is a hornby uncoupling ramp.took a few sessions to master shunting but all good fun in the endi recommend to you stick one of these at the beginning of sidings or near to junctions for convenience 
Waldo,Elcombe,7/3/1986,163, 4.0 , four gold again they cry and again i say it does what it says on the pack another worth while and well made product to add to your ever expanding layout again its made to a very and engineered high standard indeed highly recommended i am off to uncouple a couple of trucks so without further delay i will say good bye for now 
Waldo,Elcombe,7/3/1986,164, 4.0 , Purchased my son his first Hornby train set last year he purchased these sets himself to increase the fun - good value 
Waldo,Elcombe,7/3/1986,165, 2.0 , Not a lot of use if you are looking for a new uncoupling system - did not realise that what looks like and operating lever is just a position marker 
Waldo,Elcombe,7/3/1986,166, 5.0 , Purchased for use on my model railway outfit and does exactly what it says on the box
Waldo,Elcombe,7/3/1986,167, 1.0 , Just the job. Reasonable & quick delivery. Thank you for the quick service. Got no more to say. Why do I have to add to my first comment? its a waste of time
Waldo,Elcombe,7/3/1986,168, 4.0 , works great with Hornby engines 
Giuseppe,Pashbee,6/16/1994,210, 5.0 , nice 2 see smoke again
Giuseppe,Pashbee,6/16/1994,170, 5.0 , Fab items !
Giuseppe,Pashbee,6/16/1994,171, 5.0 , the cleaning wagon did everything I required it to do much better than I expected it hovered a lot of fluff & dust 
Giuseppe,Pashbee,6/16/1994,172, 4.0 , Was bought this for Christmas.Ideal for cleaning track you cant reach.I have heard it derails on Peco pointswhich my one does.On close inspection I noted the pins on the point rodding sit above track level and catch the buffing/polishing wheel(these can be cut level with the track).The reason for four stars iswhen I used the Dapol track cleaning fluid it broke down the adhesive holding the pads to the spinning discsletting them fall off. 
Giuseppe,Pashbee,6/16/1994,173, 4.0 , Good hover but abrasive pad and polish pad not so good 
Giuseppe,Pashbee,6/16/1994,174, 5.0 , It does exactly as it states on the box - good value. Caution: make sure that your ballast is glued in place!
Giuseppe,Pashbee,6/16/1994,175, 5.0 , Good little train set something different to the normal with having a crane.The crane is the normal Hornby Breakdown crane which you can get in a steam era rusty colour or modern painted yellow.  This one is red with a British Rail symbol on the side (like from the 1980s). Of course that doesnt match with steam train (a few decades out!); but this being a beginners train set that wont matter most young children (just be careful if your recipient is very clued up on these things!). The crane is weighted so it wont tip over when used to lift derailled trucks and wagons.  Add on winders are plugged in to operate the hook and crane height. Excellent pulley mechanism for raising the crane arm.The train has a plain colour scheme like a general shunting train as if it were one of many of the same kind. Almost gave it 4 stars because of this but its low priced so it stays at 5.The controller track wagon are all the usual good Hornby quality.Excellent small starter trainset especially if you want to do more than just watch a train go round and round..... 
Giuseppe,Pashbee,6/16/1994,176, 5.0 , Great amount of track high quality crane and boxcar.lovely little loco its not a pocket rocket it runs at a really nice speed for its size its not a Mallard but its still one of my favourite locos I own(You can tell somethings good when a teenager gives 5 stars) 
Giuseppe,Pashbee,6/16/1994,177, 4.0 , Nice starter set - has the standard basic oval and Track Pack one track and a midi mat. The mat is paper so not really durable for using over and over again unless you build a baseboard.The locomotive is a little under powered for the wagons - you need to be quite gentle setting off to prevent slipping and the crane is quite hard to position on the rails so maybe not the best for younger children who might get frustrated with.The detail on the engine is quite basic - if you like realism a bit of weathering may be good to make it look a bit better. The crane is lovely and nicely detailed. 
Giuseppe,Pashbee,6/16/1994,178, 5.0 , Present for My Son looks simple and different His first train set and a fair price
Giuseppe,Pashbee,6/16/1994,179, 5.0 , Took a little time to work out the instructions which were in Japanese but now working well and a great item.
Giuseppe,Pashbee,6/16/1994,180, 5.0 , This is an excellent signal kit. Simple to build and works very well
Giuseppe,Pashbee,6/16/1994,181, 5.0 , Kato - made in Japan. Top quality N-gauge chassis. Picks up on all 8 wheels drives through 4 wheels on one bogie. This is useful as its easy to shorten or lengthen the chassis to suit. I am using it under a 009 diesel kit and have had to shorten it by about 3mm to suit. This was quite easy and much easier than most 8 wheel drive chassis. The chassis itself is an excellent and smooth runner. Gaugemaster deliver well packaged and promptly. 
Giuseppe,Pashbee,6/16/1994,182, 5.0 , An excellent little motor unit for the railway on my model pier. It runs very smoothly on two AA batteries at a suitable speed. I just have to build a tram body around it that looks authentic for the surroundings. I have also ordered a four-wheel version. 
Giuseppe,Pashbee,6/16/1994,183, 5.0 , Useful 4 axle chassis for N or OO9 gauge scratchbuilding trams etc. Can be adapted to fit Yesteryear and TyPhoo trams. Very smooth running good at low speeds.
Jenda,Parres,8/24/1985,184, 4.0 , I dont own any of Heljans 47 but I find these Bachmanns (Diamond Jubilee is one of three recent additions) to be a huge improvement on the now ageing Lima models but certainly worth the additional cost.
Jenda,Parres,8/24/1985,185, 5.0 , The  Mak G 1206 locomotives are my some of my favorites. These Piko locomotives I believe that are the best of all the company! Dont expect the high quality of Marklin or Trix Mak G 1206s but the Piko Expert locomotives of this class are wonderful. You can also make from simple DC to DCC or DCC Sound! Piko has found the right way for train modellbahn!!!
